{
  "$schema": "http://json-schema.org/draft-07/schema#",
  "title": "EvidenceDossierSchema",
  "description": "Canonical machine-readable contract for research evidence collected by Research Agent",
  "type": "object",
  "required": [
    "article_id",
    "generated_at",
    "sources",
    "evidence_summary"
  ],
  "properties": {
    "article_id": {
      "type": "string",
      "description": "Article identifier, e.g., BLOG_04"
    },
    "generated_at": {
      "type": "string",
      "format": "date-time"
    },
    "researcher": {
      "type": "string",
      "default": "research_agent"
    },
    "source_policy_exception": {
      "type": "object",
      "description": "Machine-readable exception for narrow technical topics where 1-3 primary authoritative sources suffice (ADR-024)",
      "required": [
        "source_policy_exception",
        "exception_type",
        "reason",
        "approved_by_review_gate"
      ],
      "properties": {
        "source_policy_exception": {
          "type": "boolean",
          "description": "Flag indicating an authoritative-source exception is requested"
        },
        "exception_type": {
          "type": "string",
          "description": "Category of exception",
          "enum": [
            "NARROW_AUTHORITATIVE_TOPIC",
            "SINGLE_OEM_PROCEDURE",
            "SPECIFIC_STANDARD_CLAUSE",
            "NONE"
          ]
        },
        "reason": {
          "type": "string",
          "description": "Detailed justification explaining why 1-3 primary sources are authoritative and sufficient"
        },
        "approved_by_review_gate": {
          "type": "boolean",
          "description": "Whether the Technical Review Gate approved this exception"
        },
        "review_verdict": {
          "type": "string",
          "enum": [
            "PENDING",
            "APPROVE_EXCEPTION",
            "REJECT_EXCEPTION",
            "NOT_APPLICABLE"
          ]
        },
        "review_notes": {
          "type": "string"
        }
      },
      "additionalProperties": false
    },
    "evidence_summary": {
      "type": "object",
      "required": [
        "total_sources",
        "tier_1_count",
        "tier_2_count",
        "tier_3_count",
        "high_tier_ratio"
      ],
      "properties": {
        "total_sources": {
          "type": "integer",
          "minimum": 1
        },
        "tier_1_count": {
          "type": "integer",
          "minimum": 0
        },
        "tier_2_count": {
          "type": "integer",
          "minimum": 0
        },
        "tier_3_count": {
          "type": "integer",
          "minimum": 0
        },
        "high_tier_ratio": {
          "type": "number",
          "description": "Ratio of Tier 1 + Tier 2 sources (target >= 0.70)"
        }
      }
    },
    "sources": {
      "type": "array",
      "description": "Array of verified technical sources with Stable Source IDs",
      "items": {
        "type": "object",
        "required": [
          "source_id",
          "source_type",
          "title",
          "publisher",
          "tier",
          "canonical_url",
          "retrieval_url",
          "access_status",
          "content_identity_verified",
          "claim_verified",
          "locator_verified",
          "verification_date"
        ],
        "properties": {
          "source_id": {
            "type": "string",
            "description": "Stable Source ID formatted as SRC-xxx (NEVER use IEEE numbers at research stage)",
            "pattern": "^SRC-[0-9]{3,}$"
          },
          "source_type": {
            "type": "string",
            "description": "Open taxonomy of source types with review fallback",
            "enum": [
              "STANDARD",
              "MANUAL",
              "JOURNAL_PAPER",
              "CONF_PAPER",
              "BLOG_POST",
              "WEB_ARTICLE",
              "TECH_REPORT",
              "BOOK",
              "DATASHEET",
              "THESIS",
              "DATASET",
              "PREPRINT",
              "PATENT",
              "LEGAL",
              "VIDEO",
              "OTHER_IEEE_SUPPORTED",
              "SOURCE_TYPE_REVIEW_REQUIRED"
            ]
          },
          "title": {
            "type": "string"
          },
          "publisher": {
            "type": "string"
          },
          "publication_year": {
            "type": "integer"
          },
          "tier": {
            "type": "string",
            "enum": [
              "TIER_1",
              "TIER_2",
              "TIER_3"
            ]
          },
          "url": {
            "type": "string",
            "format": "uri",
            "description": "Direct link or primary reference URL (backwards-compatible alias)"
          },
          "canonical_url": {
            "type": "string",
            "format": "uri",
            "description": "Stable official canonical URL used for the public Reference List"
          },
          "retrieval_url": {
            "type": "string",
            "format": "uri",
            "description": "Actual URL used by Agent to retrieve document or direct PDF"
          },
          "access_status": {
            "type": "string",
            "description": "Network accessibility status (HTTP access separated from content verification)",
            "enum": [
              "OK",
              "REDIRECTED_OK",
              "ACCESS_RESTRICTED",
              "AUTH_REQUIRED",
              "NOT_FOUND",
              "NETWORK_ERROR",
              "UNKNOWN"
            ]
          },
          "content_identity_verified": {
            "type": "boolean",
            "description": "Whether title, publisher, doc number, version, and year match the claimed publication identity"
          },
          "claim_verified": {
            "type": "boolean",
            "description": "Whether specific technical claims are verified against the actual text read by the Agent"
          },
          "locator_verified": {
            "type": "boolean",
            "description": "Whether specific page, table, section, or equation locator has been physically checked"
          },
          "locator_status": {
            "type": "string",
            "enum": [
              "LOCATOR_VERIFIED",
              "LOCATOR_UNAVAILABLE",
              "LOCATOR_NOT_CHECKED",
              "LOCATOR_CONFLICT"
            ]
          },
          "verification_date": {
            "type": "string",
            "description": "Date when the source was verified (YYYY-MM-DD)"
          },
          "research_question_ids": {
            "type": "array",
            "description": "Research questions (RQ-xxx) addressed by this source",
            "items": {
              "type": "string",
              "pattern": "^RQ-[0-9]{3,}$"
            }
          },
          "accepted_from_candidate_id": {
            "type": "string",
            "description": "Candidate ID (CAN-xxx) from which this source was vetted and accepted",
            "pattern": "^CAN-[0-9]{3,}$"
          },
          "supersedes_source_id": {
            "type": "string",
            "description": "Prior source ID superseded by this revision if applicable"
          },
          "metadata": {
            "type": "object",
            "description": "Additional bibliographic fields (authors, standard number, edition, DOI)",
            "additionalProperties": true
          },
          "locators": {
            "type": "array",
            "description": "Verified locators within the source",
            "items": {
              "type": "object",
              "required": [
                "locator_type",
                "locator_value",
                "verified"
              ],
              "properties": {
                "locator_type": {
                  "type": "string",
                  "enum": [
                    "PAGE",
                    "SECTION",
                    "TABLE",
                    "EQUATION",
                    "FAULT_CODE",
                    "GENERAL"
                  ]
                },
                "locator_value": {
                  "type": "string",
                  "description": "e.g., 'p. 45', 'Sec. 2.1', 'Tab. 4', 'Fault 2310'"
                },
                "document_page": {
                  "type": "integer",
                  "description": "Physical page number printed in document body"
                },
                "pdf_page_index": {
                  "type": "integer",
                  "description": "1-based absolute index of page within PDF file"
                },
                "verified": {
                  "type": "boolean"
                },
                "excerpt": {
                  "type": "string",
                  "description": "Verbatim quote or data point from the locator"
                }
              }
            }
          },
          "supported_claims": {
            "type": "array",
            "description": "List of technical statements or claims supported by this source",
            "items": {
              "type": "string"
            }
          }
        },
        "additionalProperties": false
      },
      "minItems": 1
    },
    "evidences": {
      "type": "array",
      "description": "Granular technical claims and extracted evidence points linked to research questions and sources",
      "items": {
        "type": "object",
        "required": [
          "evidence_id",
          "rq_id",
          "source_id",
          "claim",
          "evidence_type",
          "verification_status",
          "locator_status"
        ],
        "properties": {
          "evidence_id": {
            "type": "string",
            "description": "Evidence item identifier formatted as EVD-xxx",
            "pattern": "^EVD-[0-9]{3,}$"
          },
          "rq_id": {
            "type": "string",
            "description": "Associated research question ID formatted as RQ-xxx",
            "pattern": "^RQ-[0-9]{3,}$"
          },
          "source_id": {
            "type": "string",
            "description": "Associated Stable Source ID formatted as SRC-xxx",
            "pattern": "^SRC-[0-9]{3,}$"
          },
          "claim": {
            "type": "string",
            "description": "Specific technical assertion or finding"
          },
          "evidence_excerpt": {
            "type": "string",
            "description": "Concise verbatim quote or data point supporting the claim"
          },
          "evidence_type": {
            "type": "string",
            "enum": [
              "TECHNICAL_CLAIM",
              "NUMERICAL_VALUE",
              "FORMULA",
              "THRESHOLD",
              "STANDARD_REQUIREMENT",
              "OEM_RECOMMENDATION",
              "DEFINITION",
              "LIMITATION",
              "SAFETY_WARNING",
              "COMPARISON_POINT"
            ]
          },
          "verification_status": {
            "type": "string",
            "enum": [
              "VERIFIED",
              "UNVERIFIED",
              "DISPUTED"
            ]
          },
          "locator_status": {
            "type": "string",
            "enum": [
              "LOCATOR_VERIFIED",
              "LOCATOR_UNAVAILABLE",
              "LOCATOR_NOT_CHECKED",
              "LOCATOR_CONFLICT"
            ]
          },
          "locator": {
            "type": "string",
            "description": "Specific locator (e.g. 'p. 15', 'Sec. 3.2', 'Tab. 2')"
          }
        },
        "additionalProperties": false
      }
    },
    "conflicts": {
      "type": "array",
      "description": "Detected data conflicts or discrepancies between sources",
      "items": {
        "type": "object",
        "required": [
          "conflict_id",
          "rq_id",
          "source_ids",
          "description",
          "status"
        ],
        "properties": {
          "conflict_id": {
            "type": "string",
            "description": "Conflict identifier formatted as CON-xxx",
            "pattern": "^CON-[0-9]{3,}$"
          },
          "rq_id": {
            "type": "string",
            "pattern": "^RQ-[0-9]{3,}$"
          },
          "source_ids": {
            "type": "array",
            "items": {
              "type": "string",
              "pattern": "^SRC-[0-9]{3,}$"
            },
            "minItems": 2
          },
          "description": {
            "type": "string",
            "description": "Detailed explanation of the technical discrepancy or divergent vendor approach"
          },
          "status": {
            "type": "string",
            "enum": [
              "OPEN",
              "RESOLVED",
              "REVIEW_REQUIRED"
            ]
          },
          "resolution": {
            "type": [
              "string",
              "null"
            ],
            "description": "Engineering rationale resolving or contextualizing the conflict"
          }
        },
        "additionalProperties": false
      }
    }
  },
  "additionalProperties": false
}
